{"artifact_id":"evidence.raw","artifact_kind":"public-synthetic-evidence","base_revision":2,"consumed_sha256":["1c5ff0dc6b3792c042e92511330c885cbea30cb9adb393e4df69050c74c24935"],"content_path":"raw.csv","content_sha256":"5dcf4666a2c96a95f8fdce743e630dc207debb883bf6e8187ca49cd8d028a94b","created_at":"2026-10-16T00:00:00Z","media_type":"text/csv","producer_id":"parent.benchmark","run_id":"run-00000000-0000-4000-8000-000000000153","schema_version":"1.0.0"}
