{"artifact_id":"mechanism.constraint","artifact_kind":"research-artifact","base_revision":13,"consumed_sha256":["3531dda16a05367e4931d77986efcffd29f2003d5506a222d958e653211a5478"],"content_path":".arw/artifacts/accepted/mechanism.constraint/receipt.json","content_sha256":"862c261de51657f3779fc999a76ae8d1f31ffb2bd48cc143723b6a646e0eb24c","created_at":"2026-10-16T04:00:00Z","media_type":"application/json","producer_id":"parent.mechanism-example","run_id":"run-00000000-0000-4000-8000-000000000162","schema_version":"1.0.0"}
