{"artifact_id":"source.mechanisms","artifact_kind":"public-synthetic-evidence","base_revision":1,"consumed_sha256":[],"content_path":"source.json","content_sha256":"2966ef13f498cbf022ca989b5e87aa44f9e0adce458a164d20c7ae115742d171","created_at":"2026-10-16T04:00:00Z","media_type":"application/json","producer_id":"parent.mechanism-example","run_id":"run-00000000-0000-4000-8000-000000000162","schema_version":"1.0.0"}
