{"artifact_id":"mechanism.representation","artifact_kind":"research-artifact","base_revision":5,"consumed_sha256":["909c8d1a2d2e9314b187e81777e93c5acc3306e59ee3a16a08a41fab1893309e"],"content_path":".arw/artifacts/accepted/mechanism.representation/receipt.json","content_sha256":"2d9b685044cb2bf23d60cde07a604c06d1d961bfa16ce19252879218a02e01d8","created_at":"2026-10-16T04:00:00Z","media_type":"application/json","producer_id":"parent.mechanism-example","run_id":"run-00000000-0000-4000-8000-000000000162","schema_version":"1.0.0"}
