{"artifact_id":"artifact.pilot-target","artifact_kind":"author-target","base_revision":1,"consumed_sha256":["61d5dfcf97a03836962956d16ce4e485825d00954e844d82f3cb780566a9b958"],"content_path":"target.json","content_sha256":"cc43e6672781b1726ad9e5c4095ab55e603c5fddddff7ac70948a17e3fdb89e1","created_at":"2026-10-14T04:33:17Z","media_type":"application/json","producer_id":"pilot.operator","run_id":"run-b0667dc7-4f37-4151-bce4-5ed608fdefc5","schema_version":"1.0.0"}
