{"artifact_id":"mechanism.constraint","artifact_kind":"research-artifact","base_revision":13,"consumed_sha256":["11e3297e4481acda1c563fc527fe3d7ed2866cc51aaaa4ef89a86fb60201b03d"],"content_path":".arw/artifacts/accepted/mechanism.constraint/receipt.json","content_sha256":"17a103b49f154a0c5942662b3c49a656b16d5b671b786aec268ca70501878f3e","created_at":"2026-10-16T04:00:00Z","media_type":"application/json","producer_id":"parent.mechanism-example","run_id":"run-00000000-0000-4000-8000-000000000162","schema_version":"1.0.0"}
