{"artifact_id":"mechanism.representation","artifact_kind":"research-artifact","base_revision":5,"consumed_sha256":["ec08a9ce1e3cd81e162ddbe1ba482cfb22b0c9eee55862f7ad2c1cf21fb1c322"],"content_path":".arw/artifacts/accepted/mechanism.representation/receipt.json","content_sha256":"f0bf425292fdc165dbadae770d53ad116a8f4959e28ad3946673b5fa7f2dd7a0","created_at":"2026-10-16T04:00:00Z","media_type":"application/json","producer_id":"parent.mechanism-example","run_id":"run-00000000-0000-4000-8000-000000000162","schema_version":"1.0.0"}
