{"artifact_id":"mechanism.tool-loop","artifact_kind":"research-artifact","base_revision":9,"consumed_sha256":["7cf8e03a3a96d2b274d46e55f925d54f4e2f3784e759d67587df203c0ca2aabf"],"content_path":".arw/artifacts/accepted/mechanism.tool-loop/receipt.json","content_sha256":"b3c5d86ce85c58828c1a63ce0368f8a5f13808d88eca4ec7f7b4c5f1de0e597a","created_at":"2026-10-16T04:00:00Z","media_type":"application/json","producer_id":"parent.mechanism-example","run_id":"run-00000000-0000-4000-8000-000000000162","schema_version":"1.0.0"}
