{"artifact_id":"evidence.synthetic","artifact_kind":"public-synthetic-evidence","base_revision":1,"consumed_sha256":["8bd46c724d211e85fe7ea0e299f03b3394e71cce79c6cff7a49b77ac9b9533ca"],"content_path":"source.json","content_sha256":"a5c5776aae0835005d5625954953c53b224a7bb893676a2ea9e525ef6b1beb70","created_at":"2026-10-16T00:00:00Z","media_type":"application/json","producer_id":"parent.benchmark","run_id":"run-00000000-0000-4000-8000-000000000153","schema_version":"1.0.0"}
