{"artifact_id":"mechanism.tool-loop","artifact_kind":"research-artifact","base_revision":9,"consumed_sha256":["7beeadbcad13e6bdbfdfb83e3beac47086153348ea17b7e8e7633d90fe296772"],"content_path":".arw/artifacts/accepted/mechanism.tool-loop/receipt.json","content_sha256":"6d16e45bdf3cb4b57272bb6e594425ba0911308ae08f243fb8c7db64b45a7ee1","created_at":"2026-10-16T04:00:00Z","media_type":"application/json","producer_id":"parent.mechanism-example","run_id":"run-00000000-0000-4000-8000-000000000162","schema_version":"1.0.0"}
