{"artifact_id":"mechanism.representation","artifact_kind":"research-artifact","base_revision":5,"consumed_sha256":["bce7ab376957fcc3caf19485f72a8430f23ff57933dd6e20b288a8bd6e5a02f6"],"content_path":".arw/artifacts/accepted/mechanism.representation/receipt.json","content_sha256":"d229fb13430de922f3b7d545cc637d5cbed89757c917f11073b63879ca8a11ac","created_at":"2026-10-16T04:00:00Z","media_type":"application/json","producer_id":"parent.mechanism-example","run_id":"run-00000000-0000-4000-8000-000000000162","schema_version":"1.0.0"}
